<?xml version="1.0" encoding="UTF-8"?>
<tns:Buildings xmlns:gco="http://www.isotc211.org/2005/gco" 
    xmlns:gmd="http://www.isotc211.org/2005/gmd" 
    xmlns:gml="http://www.opengis.net/gml/3.2" 
    xmlns:gsr="http://www.isotc211.org/2005/gsr" 
    xmlns:gss="http://www.isotc211.org/2005/gss" 
    xmlns:gts="http://www.isotc211.org/2005/gts" 
    xmlns:tns="http://www.someserver.example.com/myns/NewXMLSchema" 
    xmlns:xlink="http://www.w3.org/1999/xlink" 
    xmlns:xml="http://www.w3.org/XML/1998/namespace" 
    xmlns:xsi="http://www.w3.org/2001/XMLSchema-instance" 
    xsi:schemaLocation="http://www.someserver.example.com/
    myns/NewXMLSchema NewXMLSchema.xsd ">
  <tns:PlotBoundary gml:remoteSchema="http://tempuri.org" 
      nilReason="inapplicable" owns="false" 
      xlink:actuate="onLoad" xlink:arcrole="http://tempuri.org" 
      xlink:href="http://tempuri.org" xlink:role="http://tempuri.org" 
      xlink:show="new" xlink:title="" xlink:type="simple">
    <gml:Polygon axisLabels="" 
        gml:id="idvalue0" srsDimension="1" 
        srsName="http://tempuri.org" uomLabels=""/>
  </tns:PlotBoundary>
  <tns:BuildingFootprint gml:remoteSchema="http://tempuri.org" 
      nilReason="inapplicable" owns="false" xlink:actuate="onLoad" 
      xlink:arcrole="http://tempuri.org" xlink:href="http://tempuri.org" 
      xlink:role="http://tempuri.org" xlink:show="new" 
      xlink:title="" xlink:type="simple">
    <gml:Polygon axisLabels="" gml:id="idvalue1" srsDimension="1" 
        srsName="http://tempuri.org" uomLabels=""/>
  </tns:BuildingFootprint>
  <tns:NoOfFloors>2</tns:NoOfFloors>
  <tns:Basement>Yes</tns:Basement>
  <tns:HeightOfBuilding>14</tns:HeightOfBuilding>
  <tns:YearofEstablishment>1998</tns:YearofEstablishment>
  <tns:NoOfHouseholds>12</tns:NoOfHouseholds>
  <tns:BuildingUse>Residential</tns:BuildingUse>
  <tns:AccessToElectricity>Yes</tns:AccessToElectricity>
  <tns:ConnectivityToSewerSys>Yes</tns:ConnectivityToSewerSys>
  <tns:ConnectivityToWaterSupply>Yes</tns:ConnectivityToWaterSupply>
  <tns:RoofArea>25.2</tns:RoofArea>
  <tns:RoadWidthInFront>12.36</tns:RoadWidthInFront>
</tns:Buildings>
